message_id,event,groupJid,sender_id,push_name,message_type,message_content,media_url,base64_data,reaction,latitude,longitude,sequence_number,display_name,vcard,poll_data,source,reaction_message_id,quoted_message,data,group_id,group_name,package_id_x,project_id,grupo_created_at,package_name,package_description,package_id_y,stage_id,project_name,store_name,domain,url,niche,logo,mined_urls,contact_email,social_media_links,status,description,project_created_at,project_updated_at,estimated_deadline,closed_at
0b5066d9-5ca1-497b-9cee-e0eea4168417,messages.upsert,024509451509359969@g.us,5558980748460,Luiza Goodds - Central de atendimento,texto,"Boa tarde pessoal, tudo bem por aí?",,,,,,,,,,,,,2024-03-07,2,Maiara-Mayavant,2,2,2024-10-04 02:25:11.187973,Pacote Global Dois Em Um,Pacote Global Dois Em Um,2,1,Maiara-Mayavant,,,,,,,,,ativo,,2024-02-19 02:23:17.387,2024-10-04 02:23:17.387113,,
52e85c1c-9145-4344-ae1b-b1dab157e1d5,messages.upsert,024509451509359969@g.us,5558980748460,Luiza Goodds - Central de atendimento,texto,"Podemos dar inicio ao cadastro dos 30 produtos, usando a nossa precificação padrão?",,,,,,,,,,,,,2024-03-07,2,Maiara-Mayavant,2,2,2024-10-04 02:25:11.187973,Pacote Global Dois Em Um,Pacote Global Dois Em Um,2,1,Maiara-Mayavant,,,,,,,,,ativo,,2024-02-19 02:23:17.387,2024-10-04 02:23:17.387113,,
08aed574-06ba-45d6-b1d4-61628ef33e75,messages.upsert,024509451509359969@g.us,5558980748460,Luiza Goodds - Central de atendimento,texto,"Seria a lista enviada pra vocês aqui Ma, com os produtos do AliExpress",,,,,,,,,,,,,2024-03-07,2,Maiara-Mayavant,2,2,2024-10-04 02:25:11.187973,Pacote Global Dois Em Um,Pacote Global Dois Em Um,2,1,Maiara-Mayavant,,,,,,,,,ativo,,2024-02-19 02:23:17.387,2024-10-04 02:23:17.387113,,
55d9ca9c-5936-401a-8ccb-cc60efe5c762,messages.upsert,024509451509359969@g.us,5558980748460,Luiza Goodds - Central de atendimento,texto,"Podemos cadastrar esses produtos da Dslite também, mas você chegou a falar com o Gustavo e escolher os fornecedores certinho Ma?",,,,,,,,,,,,,2024-03-07,2,Maiara-Mayavant,2,2,2024-10-04 02:25:11.187973,Pacote Global Dois Em Um,Pacote Global Dois Em Um,2,1,Maiara-Mayavant,,,,,,,,,ativo,,2024-02-19 02:23:17.387,2024-10-04 02:23:17.387113,,
f8fd1552-3935-4b4a-8096-a5cc5f418a9d,messages.upsert,024509451509359969@g.us,5558980748460,Luiza Goodds - Central de atendimento,texto,"Hmm certo, vamos precisar que você decida os fornecedores, e assine um plano lá com eles certinho",,,,,,,,,,,,,2024-03-07,2,Maiara-Mayavant,2,2,2024-10-04 02:25:11.187973,Pacote Global Dois Em Um,Pacote Global Dois Em Um,2,1,Maiara-Mayavant,,,,,,,,,ativo,,2024-02-19 02:23:17.387,2024-10-04 02:23:17.387113,,
b4c9450f-847b-4028-8eca-9ad216928d62,messages.upsert,024509451509359969@g.us,5558980748460,Luiza Goodds - Central de atendimento,texto,Assim conseguimos fazer a mineração dos produtos Ma,,,,,,,,,,,,,2024-03-07,2,Maiara-Mayavant,2,2,2024-10-04 02:25:11.187973,Pacote Global Dois Em Um,Pacote Global Dois Em Um,2,1,Maiara-Mayavant,,,,,,,,,ativo,,2024-02-19 02:23:17.387,2024-10-04 02:23:17.387113,,
