message_id,event,groupJid,sender_id,push_name,message_type,message_content,media_url,base64_data,reaction,latitude,longitude,sequence_number,display_name,vcard,poll_data,source,reaction_message_id,quoted_message,data,group_id,group_name,package_id_x,project_id,grupo_created_at,package_name,package_description,package_id_y,stage_id,project_name,store_name,domain,url,niche,logo,mined_urls,contact_email,social_media_links,status,description,project_created_at,project_updated_at,estimated_deadline,closed_at
cabe80fa-60ef-405a-8415-3d874c4f8c93,messages.upsert,024509451509359969@g.us,5558980748460,Luiza Goodds - Central de atendimento,texto,"Boa tarde Ma, tudo bem por aí?",,,,,,,,,,,,,2024-04-03,2,Maiara-Mayavant,2,2,2024-10-04 02:25:11.187973,Pacote Global Dois Em Um,Pacote Global Dois Em Um,2,1,Maiara-Mayavant,,,,,,,,,ativo,,2024-02-19 02:23:17.387,2024-10-04 02:23:17.387113,,
1247ae9c-fb60-44ab-b642-a25b5b75c61d,messages.upsert,024509451509359969@g.us,5558980748460,Luiza Goodds - Central de atendimento,texto,"Esse acesso é do Bling, correto?",,,,,,,,,,,,,2024-04-03,2,Maiara-Mayavant,2,2,2024-10-04 02:25:11.187973,Pacote Global Dois Em Um,Pacote Global Dois Em Um,2,1,Maiara-Mayavant,,,,,,,,,ativo,,2024-02-19 02:23:17.387,2024-10-04 02:23:17.387113,,
ca3925e3-08f4-44ac-82f8-29af55b7f5f0,messages.upsert,024509451509359969@g.us,5558980748460,Luiza Goodds - Central de atendimento,texto,Você já escolheu um fornecedor da Dslite?,,,,,,,,,,,,,2024-04-03,2,Maiara-Mayavant,2,2,2024-10-04 02:25:11.187973,Pacote Global Dois Em Um,Pacote Global Dois Em Um,2,1,Maiara-Mayavant,,,,,,,,,ativo,,2024-02-19 02:23:17.387,2024-10-04 02:23:17.387113,,
678f22f3-2c8a-4131-b38c-8eedc0e1c1d6,messages.upsert,024509451509359969@g.us,5558980748460,Luiza Goodds - Central de atendimento,texto,"Maravilha Ma, qual fornecedor você escolheu?",,,,,,,,,,,,,2024-04-03,2,Maiara-Mayavant,2,2,2024-10-04 02:25:11.187973,Pacote Global Dois Em Um,Pacote Global Dois Em Um,2,1,Maiara-Mayavant,,,,,,,,,ativo,,2024-02-19 02:23:17.387,2024-10-04 02:23:17.387113,,
ef626937-daca-4ff9-9c82-038232dec6a7,messages.upsert,024509451509359969@g.us,5558980748460,Luiza Goodds - Central de atendimento,texto,Você prefere esperar Ma?,,,,,,,,,,,,,2024-04-03,2,Maiara-Mayavant,2,2,2024-10-04 02:25:11.187973,Pacote Global Dois Em Um,Pacote Global Dois Em Um,2,1,Maiara-Mayavant,,,,,,,,,ativo,,2024-02-19 02:23:17.387,2024-10-04 02:23:17.387113,,
fda9fab1-0d6e-4331-82b3-80d9c4b9a5d9,messages.upsert,024509451509359969@g.us,5558980748460,Luiza Goodds - Central de atendimento,texto,"Certo sem problemas, aguardamos então Ma",,,,,,,,,,,,,2024-04-03,2,Maiara-Mayavant,2,2,2024-10-04 02:25:11.187973,Pacote Global Dois Em Um,Pacote Global Dois Em Um,2,1,Maiara-Mayavant,,,,,,,,,ativo,,2024-02-19 02:23:17.387,2024-10-04 02:23:17.387113,,
59a93d57-803b-4e5e-a5b8-9ea407537464,messages.upsert,024509451509359969@g.us,5558980748460,Luiza Goodds - Central de atendimento,texto,"Quando concluir avisa a gente para podermos dar sequência, ok",,,,,,,,,,,,,2024-04-03,2,Maiara-Mayavant,2,2,2024-10-04 02:25:11.187973,Pacote Global Dois Em Um,Pacote Global Dois Em Um,2,1,Maiara-Mayavant,,,,,,,,,ativo,,2024-02-19 02:23:17.387,2024-10-04 02:23:17.387113,,
