message_id,event,groupJid,sender_id,push_name,message_type,message_content,media_url,base64_data,reaction,latitude,longitude,sequence_number,display_name,vcard,poll_data,source,reaction_message_id,quoted_message,data,group_id,group_name,package_id_x,project_id,grupo_created_at,package_name,package_description,package_id_y,stage_id,project_name,store_name,domain,url,niche,logo,mined_urls,contact_email,social_media_links,status,description,project_created_at,project_updated_at,estimated_deadline,closed_at
1fdc6ea4-89a7-45cf-b05d-40fdbe5f6def,messages.upsert,220191283813053475@g.us,5558980748460,Luiza Goodds - Central de atendimento,texto,Bom dia pessoal tudo bem por aí?,,,,,,,,,,,,,2024-02-22,6,Dr.MuriloeMurilo-Dynathlete,2,2,2024-10-04 02:25:11.187973,Pacote Global Dois Em Um,Pacote Global Dois Em Um,2,1,Maiara-Mayavant,,,,,,,,,ativo,,2024-02-19 02:23:17.387,2024-10-04 02:23:17.387113,,
257fb015-2615-4ad3-8f3b-24a8d90af3c2,messages.upsert,220191283813053475@g.us,5558980748460,Luiza Goodds - Central de atendimento,texto,"Como nós já finalizamos a criação do layout loja do Brasil, agora vamos partir pra criação e ativação da loja global",,,,,,,,,,,,,2024-02-22,6,Dr.MuriloeMurilo-Dynathlete,2,2,2024-10-04 02:25:11.187973,Pacote Global Dois Em Um,Pacote Global Dois Em Um,2,1,Maiara-Mayavant,,,,,,,,,ativo,,2024-02-19 02:23:17.387,2024-10-04 02:23:17.387113,,
ec8fa9bd-9d95-4123-b41e-dfb1d54445af,messages.upsert,220191283813053475@g.us,5558980748460,Luiza Goodds - Central de atendimento,texto,"Só pra confirmar, vai ser global mesmo?",,,,,,,,,,,,,2024-02-22,6,Dr.MuriloeMurilo-Dynathlete,2,2,2024-10-04 02:25:11.187973,Pacote Global Dois Em Um,Pacote Global Dois Em Um,2,1,Maiara-Mayavant,,,,,,,,,ativo,,2024-02-19 02:23:17.387,2024-10-04 02:23:17.387113,,
f1c582d8-2d01-4ffb-929a-7454de15af37,messages.upsert,220191283813053475@g.us,5511960845692,Cliente 11960845692,texto,Bom dia! Isso,,,,,,,,,,,,,2024-02-22,6,Dr.MuriloeMurilo-Dynathlete,2,2,2024-10-04 02:25:11.187973,Pacote Global Dois Em Um,Pacote Global Dois Em Um,2,1,Maiara-Mayavant,,,,,,,,,ativo,,2024-02-19 02:23:17.387,2024-10-04 02:23:17.387113,,
004cb509-fc0c-4127-88c3-50fec6db5008,messages.upsert,220191283813053475@g.us,5558980748460,Luiza Goodds - Central de atendimento,texto,"Maravilha, em quais países vocês pretendem vender?",,,,,,,,,,,,,2024-02-22,6,Dr.MuriloeMurilo-Dynathlete,2,2,2024-10-04 02:25:11.187973,Pacote Global Dois Em Um,Pacote Global Dois Em Um,2,1,Maiara-Mayavant,,,,,,,,,ativo,,2024-02-19 02:23:17.387,2024-10-04 02:23:17.387113,,
