message_id,event,groupJid,sender_id,push_name,message_type,message_content,media_url,base64_data,reaction,latitude,longitude,sequence_number,display_name,vcard,poll_data,source,reaction_message_id,quoted_message,data,group_id,group_name,package_id_x,project_id,grupo_created_at,package_name,package_description,package_id_y,stage_id,project_name,store_name,domain,url,niche,logo,mined_urls,contact_email,social_media_links,status,description,project_created_at,project_updated_at,estimated_deadline,closed_at
bdeaebf6-64e8-45fb-bc57-6aaadbb319e3,messages.upsert,319892153194284268@g.us,5558980748460,Luiza Goodds - Central de atendimento,texto,"Oii Pedro, boa tarde! Conforme conversamos no privado, abrimos esse grupo pra separar as duas lojas, assim fica mais organizado",,,,,,,,,,,,,2024-07-16,7,Pedro-StoreForKids,1,2,2024-10-04 02:25:11.187973,Pacote Especial,Pacote Especial,2,1,Maiara-Mayavant,,,,,,,,,ativo,,2024-02-19 02:23:17.387,2024-10-04 02:23:17.387113,,
f61738b8-5bd0-4d44-a8b5-071c47d4171b,messages.upsert,319892153194284268@g.us,5558980748460,Luiza Goodds - Central de atendimento,imagem,‎IMG-20240708-WA0222.jpg (arquivo anexado),,,,,,,,,,,,,2024-07-16,7,Pedro-StoreForKids,1,2,2024-10-04 02:25:11.187973,Pacote Especial,Pacote Especial,2,1,Maiara-Mayavant,,,,,,,,,ativo,,2024-02-19 02:23:17.387,2024-10-04 02:23:17.387113,,
43af9835-1351-46d6-962b-f335f852c325,messages.upsert,319892153194284268@g.us,5558980748460,Luiza Goodds - Central de atendimento,texto,"Vamos lá, a primeira etapa é a definição do segmento. Como você já escolheu o nicho, que será voltado para produtos para meninas com um foco maior em mochilas, podemos também definir as categorias",,,,,,,,,,,,,2024-07-16,7,Pedro-StoreForKids,1,2,2024-10-04 02:25:11.187973,Pacote Especial,Pacote Especial,2,1,Maiara-Mayavant,,,,,,,,,ativo,,2024-02-19 02:23:17.387,2024-10-04 02:23:17.387113,,
e3f03bda-2547-4ecd-b6d9-ad02e7b3337f,messages.upsert,319892153194284268@g.us,5558980748460,Luiza Goodds - Central de atendimento,texto,"Podemos incluir mochilas, brinquedos e alguns produtos de papelaria também, o que acha?",,,,,,,,,,,,,2024-07-16,7,Pedro-StoreForKids,1,2,2024-10-04 02:25:11.187973,Pacote Especial,Pacote Especial,2,1,Maiara-Mayavant,,,,,,,,,ativo,,2024-02-19 02:23:17.387,2024-10-04 02:23:17.387113,,
d0494d90-1323-46a7-83fb-6b2cc87d5345,messages.upsert,319892153194284268@g.us,5558980748460,Luiza Goodds - Central de atendimento,texto,"Acessórios também seria uma boa opção, pulseirinhas, brinquinhos",,,,,,,,,,,,,2024-07-16,7,Pedro-StoreForKids,1,2,2024-10-04 02:25:11.187973,Pacote Especial,Pacote Especial,2,1,Maiara-Mayavant,,,,,,,,,ativo,,2024-02-19 02:23:17.387,2024-10-04 02:23:17.387113,,
