message_id,event,groupJid,sender_id,push_name,message_type,message_content,media_url,base64_data,reaction,latitude,longitude,sequence_number,display_name,vcard,poll_data,source,reaction_message_id,quoted_message,data,group_id,group_name,package_id_x,project_id,grupo_created_at,package_name,package_description,package_id_y,stage_id,project_name,store_name,domain,url,niche,logo,mined_urls,contact_email,social_media_links,status,description,project_created_at,project_updated_at,estimated_deadline,closed_at
42504476-9415-4cc3-8928-5f100bccce62,messages.upsert,765321137722616028@g.us,5558980748460,Luiza Goodds - Central de atendimento,texto,"Bom dia Nitiel, tudo bem por aí?",,,,,,,,,,,,,2024-07-31,10,Nitiel-Apertto,2,2,2024-10-04 02:25:11.187973,Pacote Global Dois Em Um,Pacote Global Dois Em Um,2,1,Maiara-Mayavant,,,,,,,,,ativo,,2024-02-19 02:23:17.387,2024-10-04 02:23:17.387113,,
d7b5ac85-2e06-4056-9cd6-7b15715d03e9,messages.upsert,765321137722616028@g.us,5558980748460,Luiza Goodds - Central de atendimento,texto,Muito obrigada!,,,,,,,,,,,,,2024-07-31,10,Nitiel-Apertto,2,2,2024-10-04 02:25:11.187973,Pacote Global Dois Em Um,Pacote Global Dois Em Um,2,1,Maiara-Mayavant,,,,,,,,,ativo,,2024-02-19 02:23:17.387,2024-10-04 02:23:17.387113,,
7e480156-a5ae-420e-a213-4c949f144fc2,messages.upsert,765321137722616028@g.us,555493220768,Cliente 5493220768,texto,Bom dia pessoal,,,,,,,,,,,,,2024-07-31,10,Nitiel-Apertto,2,2,2024-10-04 02:25:11.187973,Pacote Global Dois Em Um,Pacote Global Dois Em Um,2,1,Maiara-Mayavant,,,,,,,,,ativo,,2024-02-19 02:23:17.387,2024-10-04 02:23:17.387113,,
3eca0607-9be8-440f-9fc7-e65106ca712c,messages.upsert,765321137722616028@g.us,5558980748460,Luiza Goodds - Central de atendimento,texto,Opaaa NItiel boa tarde! Tudo bem por aí?,,,,,,,,,,,,,2024-07-31,10,Nitiel-Apertto,2,2,2024-10-04 02:25:11.187973,Pacote Global Dois Em Um,Pacote Global Dois Em Um,2,1,Maiara-Mayavant,,,,,,,,,ativo,,2024-02-19 02:23:17.387,2024-10-04 02:23:17.387113,,
724db926-81aa-4c63-8475-f8a5d583ae38,messages.upsert,765321137722616028@g.us,5558980748460,Luiza Goodds - Central de atendimento,texto,Os posts para o Insta ficaram prontos! Eu vou encaminhar aqui pra você dar uma olhadinha,,,,,,,,,,,,,2024-07-31,10,Nitiel-Apertto,2,2,2024-10-04 02:25:11.187973,Pacote Global Dois Em Um,Pacote Global Dois Em Um,2,1,Maiara-Mayavant,,,,,,,,,ativo,,2024-02-19 02:23:17.387,2024-10-04 02:23:17.387113,,
9e2ce505-5e5c-461b-844e-3e69eb26acaa,messages.upsert,765321137722616028@g.us,5558980748460,Luiza Goodds - Central de atendimento,texto,https://drive.google.com/drive/folders/1-_Deumbu2mhPFplf5ppaD8379cACp4_e?usp=sharing,,,,,,,,,,,,,2024-07-31,10,Nitiel-Apertto,2,2,2024-10-04 02:25:11.187973,Pacote Global Dois Em Um,Pacote Global Dois Em Um,2,1,Maiara-Mayavant,,,,,,,,,ativo,,2024-02-19 02:23:17.387,2024-10-04 02:23:17.387113,,
7b2e2c80-efcc-4522-a465-0de0dd7df118,messages.upsert,765321137722616028@g.us,5558980748460,Luiza Goodds - Central de atendimento,texto,"Você aprovando, a equipe já começa a programação dos posts ☑️",,,,,,,,,,,,,2024-07-31,10,Nitiel-Apertto,2,2,2024-10-04 02:25:11.187973,Pacote Global Dois Em Um,Pacote Global Dois Em Um,2,1,Maiara-Mayavant,,,,,,,,,ativo,,2024-02-19 02:23:17.387,2024-10-04 02:23:17.387113,,
f6fa97fb-2a2c-422e-9a68-3d510dab9746,messages.upsert,765321137722616028@g.us,555493220768,Cliente 5493220768,texto,Vou verificar,,,,,,,,,,,,,2024-07-31,10,Nitiel-Apertto,2,2,2024-10-04 02:25:11.187973,Pacote Global Dois Em Um,Pacote Global Dois Em Um,2,1,Maiara-Mayavant,,,,,,,,,ativo,,2024-02-19 02:23:17.387,2024-10-04 02:23:17.387113,,
f10d21bb-e3e5-4fdc-9eb8-252c3f468b29,messages.upsert,765321137722616028@g.us,555493220768,Cliente 5493220768,texto,"Verifiquei imagem por imagem, gostei das artes, ficou bem legal, tá aprovado✅",,,,,,,,,,,,,2024-07-31,10,Nitiel-Apertto,2,2,2024-10-04 02:25:11.187973,Pacote Global Dois Em Um,Pacote Global Dois Em Um,2,1,Maiara-Mayavant,,,,,,,,,ativo,,2024-02-19 02:23:17.387,2024-10-04 02:23:17.387113,,
