message_id,event,groupJid,sender_id,push_name,message_type,message_content,media_url,base64_data,reaction,latitude,longitude,sequence_number,display_name,vcard,poll_data,source,reaction_message_id,quoted_message,data,group_id,group_name,package_id_x,project_id,grupo_created_at,package_name,package_description,package_id_y,stage_id,project_name,store_name,domain,url,niche,logo,mined_urls,contact_email,social_media_links,status,description,project_created_at,project_updated_at,estimated_deadline,closed_at
1d5a6f33-8eb5-4f08-9043-bf6e2fb47d05,messages.upsert,765321137722616028@g.us,5558980748460,Luiza Goodds - Central de atendimento,texto,"Bom dia, Nitiel! Tudo bem por a칤?",,,,,,,,,,,,,2024-07-22,10,Nitiel-Apertto,2,2,2024-10-04 02:25:11.187973,Pacote Global Dois Em Um,Pacote Global Dois Em Um,2,1,Maiara-Mayavant,,,,,,,,,ativo,,2024-02-19 02:23:17.387,2024-10-04 02:23:17.387113,,
14115489-2f36-47b7-bbff-f4b3aca47243,messages.upsert,765321137722616028@g.us,5558980748460,Luiza Goodds - Central de atendimento,texto,Nossa equipe de desenvolvimento est치 finalizando o layout da sua loja e gostar칤amos de agendar a call de apresenta칞칚o 游뱔 voc칡 teria disponibilidade amanh칚 맙 15:30?,,,,,,,,,,,,,2024-07-22,10,Nitiel-Apertto,2,2,2024-10-04 02:25:11.187973,Pacote Global Dois Em Um,Pacote Global Dois Em Um,2,1,Maiara-Mayavant,,,,,,,,,ativo,,2024-02-19 02:23:17.387,2024-10-04 02:23:17.387113,,
9face984-53e9-473f-a693-e926cf509fab,messages.upsert,765321137722616028@g.us,5558980748460,Luiza Goodds - Central de atendimento,texto,"S칩 precisaremos que esteja em um computador, a call ser치 feita pelo Google Meet ok",,,,,,,,,,,,,2024-07-22,10,Nitiel-Apertto,2,2,2024-10-04 02:25:11.187973,Pacote Global Dois Em Um,Pacote Global Dois Em Um,2,1,Maiara-Mayavant,,,,,,,,,ativo,,2024-02-19 02:23:17.387,2024-10-04 02:23:17.387113,,
ad71f65e-1307-490b-96f0-9fc9ca3a280b,messages.upsert,765321137722616028@g.us,555493220768,Cliente 5493220768,texto,Bom dia pessoal,,,,,,,,,,,,,2024-07-22,10,Nitiel-Apertto,2,2,2024-10-04 02:25:11.187973,Pacote Global Dois Em Um,Pacote Global Dois Em Um,2,1,Maiara-Mayavant,,,,,,,,,ativo,,2024-02-19 02:23:17.387,2024-10-04 02:23:17.387113,,
224ee566-34a3-4edf-930a-babd30c83302,messages.upsert,765321137722616028@g.us,555493220768,Cliente 5493220768,texto,"Claro, esse hor치rio est치 perfeito pra mim",,,,,,,,,,,,,2024-07-22,10,Nitiel-Apertto,2,2,2024-10-04 02:25:11.187973,Pacote Global Dois Em Um,Pacote Global Dois Em Um,2,1,Maiara-Mayavant,,,,,,,,,ativo,,2024-02-19 02:23:17.387,2024-10-04 02:23:17.387113,,
b2d30c6b-b689-4a0c-8a67-c5bd73b182d0,messages.upsert,765321137722616028@g.us,555493220768,Cliente 5493220768,texto,Entendido,,,,,,,,,,,,,2024-07-22,10,Nitiel-Apertto,2,2,2024-10-04 02:25:11.187973,Pacote Global Dois Em Um,Pacote Global Dois Em Um,2,1,Maiara-Mayavant,,,,,,,,,ativo,,2024-02-19 02:23:17.387,2024-10-04 02:23:17.387113,,
50909d34-e845-43d2-804b-7849b8d89349,messages.upsert,765321137722616028@g.us,5558980748460,Luiza Goodds - Central de atendimento,texto,"Maravilha ent칚o Nitiel, marcado 驕놾잺",,,,,,,,,,,,,2024-07-22,10,Nitiel-Apertto,2,2,2024-10-04 02:25:11.187973,Pacote Global Dois Em Um,Pacote Global Dois Em Um,2,1,Maiara-Mayavant,,,,,,,,,ativo,,2024-02-19 02:23:17.387,2024-10-04 02:23:17.387113,,
