message_id,event,groupJid,sender_id,push_name,message_type,message_content,media_url,base64_data,reaction,latitude,longitude,sequence_number,display_name,vcard,poll_data,source,reaction_message_id,quoted_message,data,group_id,group_name,package_id_x,project_id,grupo_created_at,package_name,package_description,package_id_y,stage_id,project_name,store_name,domain,url,niche,logo,mined_urls,contact_email,social_media_links,status,description,project_created_at,project_updated_at,estimated_deadline,closed_at
b424eb3b-ad07-43d3-88ee-bc689b1a12f6,messages.upsert,765321137722616028@g.us,5558980748460,Luiza Goodds - Central de atendimento,texto,"Bom dia, Nitiel! Tudo bem por aí?",,,,,,,,,,,,,2024-09-09,10,Nitiel-Apertto,2,2,2024-10-04 02:25:11.187973,Pacote Global Dois Em Um,Pacote Global Dois Em Um,2,1,Maiara-Mayavant,,,,,,,,,ativo,,2024-02-19 02:23:17.387,2024-10-04 02:23:17.387113,,
394682ab-3a33-42f6-8795-fdd4db8f0bcd,messages.upsert,765321137722616028@g.us,5558980748460,Luiza Goodds - Central de atendimento,texto,"Certo, você não deseja seguir com as campanhas então, correto?",,,,,,,,,,,,,2024-09-09,10,Nitiel-Apertto,2,2,2024-10-04 02:25:11.187973,Pacote Global Dois Em Um,Pacote Global Dois Em Um,2,1,Maiara-Mayavant,,,,,,,,,ativo,,2024-02-19 02:23:17.387,2024-10-04 02:23:17.387113,,
5d428877-0a71-4f1e-8401-3f5000936d3b,messages.upsert,765321137722616028@g.us,555493220768,Cliente 5493220768,texto,Sim,,,,,,,,,,,,,2024-09-09,10,Nitiel-Apertto,2,2,2024-10-04 02:25:11.187973,Pacote Global Dois Em Um,Pacote Global Dois Em Um,2,1,Maiara-Mayavant,,,,,,,,,ativo,,2024-02-19 02:23:17.387,2024-10-04 02:23:17.387113,,
86a87b54-afbb-485b-9ab7-b22edcae70f8,messages.upsert,765321137722616028@g.us,5558980748460,Luiza Goodds - Central de atendimento,texto,"Sem problemas então Nitiel, vou pedir pro adm seguir com o fechamento do grupo",,,,,,,,,,,,,2024-09-09,10,Nitiel-Apertto,2,2,2024-10-04 02:25:11.187973,Pacote Global Dois Em Um,Pacote Global Dois Em Um,2,1,Maiara-Mayavant,,,,,,,,,ativo,,2024-02-19 02:23:17.387,2024-10-04 02:23:17.387113,,
7a0f7ac9-25ee-4aac-9f1c-2421a6755456,messages.upsert,765321137722616028@g.us,5558980748460,Luiza Goodds - Central de atendimento,texto,"Agradecemos pela confiança, e te desejamos todo o sucesso do mundo! 🚀🚀",,,,,,,,,,,,,2024-09-09,10,Nitiel-Apertto,2,2,2024-10-04 02:25:11.187973,Pacote Global Dois Em Um,Pacote Global Dois Em Um,2,1,Maiara-Mayavant,,,,,,,,,ativo,,2024-02-19 02:23:17.387,2024-10-04 02:23:17.387113,,
00f41a13-a4ad-4308-afc9-e210d30e8eaa,messages.upsert,765321137722616028@g.us,5558980748460,Luiza Goodds - Central de atendimento,texto,@5511969021339,,,,,,,,,,,,,2024-09-09,10,Nitiel-Apertto,2,2,2024-10-04 02:25:11.187973,Pacote Global Dois Em Um,Pacote Global Dois Em Um,2,1,Maiara-Mayavant,,,,,,,,,ativo,,2024-02-19 02:23:17.387,2024-10-04 02:23:17.387113,,
4ea52282-faad-4679-a6c2-be77310e977f,messages.upsert,765321137722616028@g.us,5518919879626,Giovana Goodds,texto,"Olá, boa tarde! Tudo bem?",,,,,,,,,,,,,2024-09-09,10,Nitiel-Apertto,2,2,2024-10-04 02:25:11.187973,Pacote Global Dois Em Um,Pacote Global Dois Em Um,2,1,Maiara-Mayavant,,,,,,,,,ativo,,2024-02-19 02:23:17.387,2024-10-04 02:23:17.387113,,
a7599180-05fe-45ad-a676-f777585ec257,messages.upsert,765321137722616028@g.us,5518919879626,Giovana Goodds,texto,"Valorizamos muito o relacionamento que construímos, e agradecemos pela confiança em nosso trabalho.",,,,,,,,,,,,,2024-09-09,10,Nitiel-Apertto,2,2,2024-10-04 02:25:11.187973,Pacote Global Dois Em Um,Pacote Global Dois Em Um,2,1,Maiara-Mayavant,,,,,,,,,ativo,,2024-02-19 02:23:17.387,2024-10-04 02:23:17.387113,,
