message_id,event,groupJid,sender_id,push_name,message_type,message_content,media_url,base64_data,reaction,latitude,longitude,sequence_number,display_name,vcard,poll_data,source,reaction_message_id,quoted_message,data,group_id,group_name,package_id_x,project_id,grupo_created_at,package_name,package_description,package_id_y,stage_id,project_name,store_name,domain,url,niche,logo,mined_urls,contact_email,social_media_links,status,description,project_created_at,project_updated_at,estimated_deadline,closed_at
897660a4-7f9e-4df3-aab6-52e7efce3298,messages.upsert,765321137722616028@g.us,5585911489695,Rafael Goodds,texto,boa tarde @555493220768 tudo certo?,,,,,,,,,,,,,2024-09-06,10,Nitiel-Apertto,2,2,2024-10-04 02:25:11.187973,Pacote Global Dois Em Um,Pacote Global Dois Em Um,2,1,Maiara-Mayavant,,,,,,,,,ativo,,2024-02-19 02:23:17.387,2024-10-04 02:23:17.387113,,
e95e5015-8dd2-4b0c-aa3a-16db49d57ae8,messages.upsert,765321137722616028@g.us,5585911489695,Rafael Goodds,texto,Preciso que você faça uma confirmação na conta,,,,,,,,,,,,,2024-09-06,10,Nitiel-Apertto,2,2,2024-10-04 02:25:11.187973,Pacote Global Dois Em Um,Pacote Global Dois Em Um,2,1,Maiara-Mayavant,,,,,,,,,ativo,,2024-02-19 02:23:17.387,2024-10-04 02:23:17.387113,,
345a57c6-bcb3-4720-b7af-c871d1067d75,messages.upsert,765321137722616028@g.us,5585911489695,Rafael Goodds,texto,é só logar no Facebook pelo computador e entrar nesse link https://www.facebook.com/business-support-home/809769891358831,,,,,,,,,,,,,2024-09-06,10,Nitiel-Apertto,2,2,2024-10-04 02:25:11.187973,Pacote Global Dois Em Um,Pacote Global Dois Em Um,2,1,Maiara-Mayavant,,,,,,,,,ativo,,2024-02-19 02:23:17.387,2024-10-04 02:23:17.387113,,
93f0defd-a7f7-4437-ae70-40e1fed49625,messages.upsert,765321137722616028@g.us,5585911489695,Rafael Goodds,imagem,‎IMG-20240906-WA0237.jpg (arquivo anexado),,,,,,,,,,,,,2024-09-06,10,Nitiel-Apertto,2,2,2024-10-04 02:25:11.187973,Pacote Global Dois Em Um,Pacote Global Dois Em Um,2,1,Maiara-Mayavant,,,,,,,,,ativo,,2024-02-19 02:23:17.387,2024-10-04 02:23:17.387113,,
eb2e354d-7c17-49f4-ada8-abbe7df7fc79,messages.upsert,765321137722616028@g.us,555493220768,Cliente 5493220768,texto,"Boa tarde pessoal, tive alguns imprevistos e vou encerrar o projeto, agradeço a todos que fizeram parte disso, obrigado.",,,,,,,,,,,,,2024-09-06,10,Nitiel-Apertto,2,2,2024-10-04 02:25:11.187973,Pacote Global Dois Em Um,Pacote Global Dois Em Um,2,1,Maiara-Mayavant,,,,,,,,,ativo,,2024-02-19 02:23:17.387,2024-10-04 02:23:17.387113,,
