message_id,event,groupJid,sender_id,push_name,message_type,message_content,media_url,base64_data,reaction,latitude,longitude,sequence_number,display_name,vcard,poll_data,source,reaction_message_id,quoted_message,data,group_id,group_name,package_id_x,project_id,grupo_created_at,package_name,package_description,package_id_y,stage_id,project_name,store_name,domain,url,niche,logo,mined_urls,contact_email,social_media_links,status,description,project_created_at,project_updated_at,estimated_deadline,closed_at
c91debd3-02cf-4d90-9ad9-bf49b3d7f203,messages.upsert,960751260776592837@g.us,5558980748460,Luiza Goodds - Central de atendimento,texto,"Boa tarde Tiago, tudo bem por aí?",,,,,,,,,,,,,2024-02-27,11,Tiago-AkkiShop,2,2,2024-10-04 02:25:11.187973,Pacote Global Dois Em Um,Pacote Global Dois Em Um,2,1,Maiara-Mayavant,,,,,,,,,ativo,,2024-02-19 02:23:17.387,2024-10-04 02:23:17.387113,,
36345c43-dae8-4d84-bf33-6d2b929339ad,messages.upsert,960751260776592837@g.us,5558980748460,Luiza Goodds - Central de atendimento,texto,"Como a lista de produto já foi aprovada, já podemos ir escolhendo os dois produtos para as campanhas",,,,,,,,,,,,,2024-02-27,11,Tiago-AkkiShop,2,2,2024-10-04 02:25:11.187973,Pacote Global Dois Em Um,Pacote Global Dois Em Um,2,1,Maiara-Mayavant,,,,,,,,,ativo,,2024-02-19 02:23:17.387,2024-10-04 02:23:17.387113,,
b1371758-fafb-4469-a0ac-cace8e0c6d59,messages.upsert,960751260776592837@g.us,5558980748460,Luiza Goodds - Central de atendimento,texto,"Assim podemos colocar um desses produtos no avatar também, pra ele segurar um dos produtos das campanhas 😄",,,,,,,,,,,,,2024-02-27,11,Tiago-AkkiShop,2,2,2024-10-04 02:25:11.187973,Pacote Global Dois Em Um,Pacote Global Dois Em Um,2,1,Maiara-Mayavant,,,,,,,,,ativo,,2024-02-19 02:23:17.387,2024-10-04 02:23:17.387113,,
df178e21-610c-4153-aa95-2135c4ce4918,messages.upsert,960751260776592837@g.us,5558980748460,Luiza Goodds - Central de atendimento,texto,Você tem preferencia por algum produto?,,,,,,,,,,,,,2024-02-27,11,Tiago-AkkiShop,2,2,2024-10-04 02:25:11.187973,Pacote Global Dois Em Um,Pacote Global Dois Em Um,2,1,Maiara-Mayavant,,,,,,,,,ativo,,2024-02-19 02:23:17.387,2024-10-04 02:23:17.387113,,
63bf256c-78c6-47d6-9531-966ca17565b5,messages.upsert,960751260776592837@g.us,5512988225667,Cliente 12988225667,texto,Boa noite luiza,,,,,,,,,,,,,2024-02-27,11,Tiago-AkkiShop,2,2,2024-10-04 02:25:11.187973,Pacote Global Dois Em Um,Pacote Global Dois Em Um,2,1,Maiara-Mayavant,,,,,,,,,ativo,,2024-02-19 02:23:17.387,2024-10-04 02:23:17.387113,,
2bd7fa3a-da78-4eec-9164-60c1213fcf3b,messages.upsert,960751260776592837@g.us,5512988225667,Cliente 12988225667,texto,Tudo joia e vc?,,,,,,,,,,,,,2024-02-27,11,Tiago-AkkiShop,2,2,2024-10-04 02:25:11.187973,Pacote Global Dois Em Um,Pacote Global Dois Em Um,2,1,Maiara-Mayavant,,,,,,,,,ativo,,2024-02-19 02:23:17.387,2024-10-04 02:23:17.387113,,
5042c4a9-aaf5-455d-bfed-604306a5e9e4,messages.upsert,960751260776592837@g.us,5512988225667,Cliente 12988225667,texto,Maravilha,,,,,,,,,,,,,2024-02-27,11,Tiago-AkkiShop,2,2,2024-10-04 02:25:11.187973,Pacote Global Dois Em Um,Pacote Global Dois Em Um,2,1,Maiara-Mayavant,,,,,,,,,ativo,,2024-02-19 02:23:17.387,2024-10-04 02:23:17.387113,,
2a4a784b-a9b5-495b-b2c0-ccb275245b37,messages.upsert,960751260776592837@g.us,5512988225667,Cliente 12988225667,texto,Pode escolher o que vc acha melhor…,,,,,,,,,,,,,2024-02-27,11,Tiago-AkkiShop,2,2,2024-10-04 02:25:11.187973,Pacote Global Dois Em Um,Pacote Global Dois Em Um,2,1,Maiara-Mayavant,,,,,,,,,ativo,,2024-02-19 02:23:17.387,2024-10-04 02:23:17.387113,,
